commit	score	sharpe	max_dd	status	description
b366d4e	0.015504	0.2930	-0.3884	keep	baseline dual SMA 20/50 crossover
5dcd9f2	0.000000	0.3171	-0.4525	discard	SMA 10/30 + RSI(14) filter
cfa6602	0.111502	0.3795	-0.4631	keep	momentum ROC(20) + SMA50 trend filter
8b64e26	0.139120	0.4283	-0.4509	keep	momentum + Bollinger Band mean reversion
cd9e908	0.124023	0.4351	-0.4491	discard	momentum + BB + ATR vol filter
094206d	0.313876	0.5253	-0.4051	keep	momentum + BB + ADX trend strength filter
89c7fdb	0.246211	0.1163	-0.4151	discard	tune: ADX>25, ROC(15), SMA(40)
2c29a91	0.075481	0.5192	-0.4017	discard	momentum + BB + ADX + Williams %R
338cb0b	0.447859	0.4056	-0.3533	keep	momentum + BB + ADX + DI directional confirm
e54655a	0.318506	0.2784	-0.2018	discard	momentum + BB + ADX/DI + volume confirm
acfd838	0.068048	0.0286	-0.3445	discard	momentum + BB + ADX/DI + MACD confirm
2990581	0.353616	0.3760	-0.3838	discard	momentum + BB + ADX/DI + EMA50 trend
f9e7a2a	0.389449	0.2996	-0.3847	discard	SMA 10/50 crossover + ADX/DI + BB
c60fc5e	0.349810	0.3910	-0.3595	discard	ROC(30) + SMA(60) longer lookbacks
8086610	0.545632	1.1317	-0.1917	keep	long-only momentum + ADX/DI + BB
af3ed4c	0.435830	1.0516	-0.2208	discard	long-only momentum + ADX/DI (no BB)
b29a241	0.545632	1.1317	-0.1917	discard	long-only + RSI dip-buy (no effect)
64546aa	0.385162	0.6999	-0.1457	discard	long-only + SMA(200) trend filter
df64b24	0.565277	1.0239	-0.1659	keep	long-only + DI spread>5 filter
e136444	0.591383	0.5282	-0.1616	keep	long-only + DI spread>10 filter
93f5df0	0.553025	0.9928	-0.1251	discard	long-only + DI spread>15 (too strict)
ca1f301	0.491022	0.4813	-0.1619	discard	long-only DI>10 ADX>15 (too loose)
8ad7310	0.492199	0.2214	-0.1775	discard	DI>10 ADX>25
02eb1a8	0.596170	0.4995	-0.1652	keep	long-only SMA50+ADX>20+DI>10+BB (no ROC)
355b431	0.619971	0.6471	-0.1721	keep	long-only SMA50+ADX>20+DI>12+BB
d1f4f5d	0.615309	0.8664	-0.1509	discard	DI>13 (too few trades)
7ac3878	0.557421	0.5783	-0.1776	discard	BB 1.5 std (too wide dip entries)
976b3fb	0.630124	0.6471	-0.1721	keep	long-only + vol regime filter (go flat extreme vol)
e53b5cf	0.619971	0.6471	-0.1721	discard	vol 2.5x (too loose)
3d76cd9	0.530222	0.3390	-0.1683	discard	dual SMA20>SMA50 trend (too few trades)
f98f6f7	0.447548	0.6736	-0.1882	discard	ADX period 20 (too few trades)
4992bc4	0.496850	0.5636	-0.1725	discard	no BB (BB essential for trade count)
ad46f7d	0.622623	0.6437	-0.1721	discard	SMA20 exit signal (marginal)
8976adb	0.430993	0.6771	-0.1684	discard	DI momentum signal (hurt consistency)
6dba23e	0.079267	-0.2417	-0.1355	discard	RSI<70 overbought filter (too restrictive)
838c48a	0.512652	0.4890	-0.1768	discard	Keltner Channel breakout (added noise)
b3671d6	0.598116	0.6248	-0.1712	discard	vol filter 1.8x (too tight)
0d69e01	0.539430	0.3719	-0.1693	discard	ADX rising filter (too restrictive)
9f7c053	0.496101	0.5636	-0.1725	discard	BB dip-buy with DI>0 filter (hurt trades)
bf11fd2	0.603843	0.5324	-0.1795	discard	adaptive DI threshold (slight regression)
a8039b3	0.589411	0.8407	-0.1607	discard	SMA50 pullback entry (hurt consistency)
71fc107	0.613095	0.5525	-0.1675	discard	DI>11 (marginal gain, Sharpe drop)
3b876e6	0.540037	0.6139	-0.2019	discard	ADX>18 (weak trends hurt DD and consistency)
658bfb5	0.527086	0.6190	-0.1721	discard	EMA50 trend (fewer trades, less consistent)
af1d91f	0.697143	0.8219	-0.1490	keep	add secondary ADX>36/DI>6 entry + BB upper breakout
eaf6d10	0.707005	0.8572	-0.1490	keep	smooth DI(3) for BB breakout signal
b4ac2cf	0.706590	0.8659	-0.1490	discard	BB breakout DI threshold 6 (was 8)
36b6340	0.680880	0.9779	-0.1451	discard	secondary ADX threshold 32 (consistency crashed)
e663dd5	0.674533	0.9289	-0.1413	discard	primary DI threshold 13 (consistency dropped)
4fa5a22	0.706021	0.8572	-0.1490	discard	BB breakout DI threshold 10 (marginal regression)
055b072	0.718617	0.8545	-0.1490	keep	BB breakout requires ADX>20 confirmation
0063f91	0.722816	0.8214	-0.1611	keep	secondary ADX threshold 38 (consistency 0.90!)
e9a638d	0.705555	0.9754	-0.1477	discard	secondary ADX 40 (too restrictive, consistency dropped)
897a65e	0.710936	0.9726	-0.1592	discard	secondary DI 5 (consistency dropped)
6199ab6	0.718890	0.7834	-0.1600	discard	secondary DI 7 (marginal regression)
cf8c7fd	0.719021	0.8214	-0.1611	discard	BB breakout DI 7 (marginal regression)
961a25d	0.723077	0.8214	-0.1611	keep	BB breakout DI threshold 9 (marginal improvement)
d808032	0.711342	0.8214	-0.1611	discard	vol filter 2.2x (regression)
2f823d0	0.684502	0.7894	-0.1674	discard	primary ADX 21 (regression)
250fc82	0.599220	0.7471	-0.1852	discard	SMA45 trend (regression)
9ddec61	0.721603	0.8214	-0.1611	discard	DI smoothing 2 (marginal regression)
caec196	0.723077	0.8214	-0.1611	discard	DI smoothing 4 (same score as best)
cf7d274	0.713100	0.8214	-0.1611	discard	disable vol filter (regression)
ce24729	0.693740	0.8002	-0.1611	discard	BB dip-buy ADX confirm (regression)
a602d75	0.716498	0.8397	-0.1601	discard	secondary ADX 37 (consistency dropped)
d169631	0.659998	0.7789	-0.1707	discard	BB std 1.8 (regression)
8739d92	0.553959	0.7440	-0.1911	discard	BB dip-buy positive DI (regression)
f53a9bf	0.709655	0.8214	-0.1611	discard	vol median 126d (regression)
a77ef05	0.725319	0.8214	-0.1611	keep	EMA smoothing for DI (breakthrough!)
d90be5a	0.721603	0.8214	-0.1611	discard	EMA span 2 (regression)
6f288e1	0.723077	0.8214	-0.1611	discard	EMA span 4 (regression)
b2df6cd	0.735962	0.8567	-0.1577	keep	secondary ADX 39 (MASSIVE breakthrough!)
6c4dbab	0.696978	0.8310	-0.1453	discard	primary DI 11 (regression)
4db5f7a	0.734172	0.8567	-0.1577	discard	BB breakout DI 8 (marginal regression)
d3ef05e	0.733659	0.8567	-0.1577	discard	BB breakout DI 10 (marginal regression)
b59da73	0.723812	0.8295	-0.1566	discard	secondary DI 7 (regression)
881386d	0.701986	0.9917	-0.1573	discard	secondary DI 5 (consistency crashed)
8ce607e	0.724795	0.8581	-0.1544	discard	primary ADX 19 (regression)
6c86f62	0.698892	0.8064	-0.1609	discard	BB period 18 (regression)
96f0dc0	0.713554	0.8444	-0.1629	discard	vol filter 1.9x (regression)
b86ef07	0.600928	0.5331	-0.1809	discard	remove secondary (regression)
125e14f	0.468827	0.5591	-0.1962	discard	ADX period 12 (regression)
5876f35	0.710306	0.8460	-0.1623	discard	vol window 15d (regression)
f31da40	0.727721	0.9319	-0.1649	discard	tertiary ADX>45 DI>4 (consistency dropped)
2c5287d	0.738771	0.7949	-0.1422	keep	volume>median on primary (NEW RECORD!)
facdd3f	0.700130	0.8554	-0.1128	discard	volume on secondary (regression)
04bbbf8	0.721711	0.7818	-0.1745	discard	volume 0.8x median (regression)
82f6620	0.708220	0.7212	-0.1685	discard	volume window 40 (regression)
09ad884	0.745486	0.7996	-0.1402	keep	primary DI 11 (BREAKTHROUGH!)
c853084	0.732327	0.7889	-0.1444	discard	primary DI 10 (regression)
81c253b	0.743575	0.8648	-0.1365	discard	secondary ADX 40 (was 39)
ebaedd1	0.699847	0.7238	-0.1665	discard	volume window 40 (was 50)
eb1c3a8	0.619032	0.7702	-0.1645	discard	BB period 25 (was 20)
aed320b	0.600072	0.7071	-0.1706	discard	volume threshold 1.1x median (was 1.0x)
323fabf	0.604291	0.7505	-0.1721	discard	add volume spike entry (2x median + ADX + DI)
654ec44	0.743826	0.7878	-0.1402	discard	BB dip-buy ADX>15 confirmation
66ce65f	0.743051	0.7889	-0.1444	discard	primary DI 11.0 (was 11.5)
67059a3	0.734035	0.7996	-0.1402	discard	vol regime 2.1x (was 2.0x)
6521b55	0.676137	0.7099	-0.1374	discard	BB upper breakout with volume filter
8165af0	0.567968	0.7214	-0.1698	discard	remove BB dip-buy entry
aeef76f	0.743870	0.7996	-0.1402	discard	BB breakout DI 9.5 (was 9)
36d8f9a	0.731622	0.8057	-0.1390	discard	secondary DI 6.5 (was 6)
636e0be	0.743453	0.7996	-0.1402	discard	vol regime window 200 (was 252)
bb757f4	0.669287	0.7994	-0.1603	discard	SMA60 trend (was SMA50)
c26e11f	0.757162	0.8474	-0.1547	keep	EMA-smoothed ADX (span=3)
bc19912	0.733505	0.8906	-0.1355	discard	ADX EMA span 2 (was 3)
372bc54	0.696519	0.8153	-0.1487	discard	ADX EMA span 4 (was 3)
fb3ff2e	0.747147	0.8643	-0.1327	discard	secondary ADX 38 with smoothed (was 39)
c1db7ec	0.758004	0.8706	-0.1392	keep	secondary ADX 40 with smoothed (was 39)
73ac081	0.749862	0.8434	-0.1270	discard	secondary ADX 41 (was 40)
98f2eda	0.753173	0.8985	-0.1392	discard	primary ADX 19 with smoothed (was 20)
f8815d4	0.709855	0.8269	-0.1475	discard	primary ADX 21 with smoothed (was 20)
6297206	0.721227	0.9865	-0.1332	discard	primary DI 12 (was 11.5)
5ebe08b	0.755372	0.8597	-0.1455	discard	primary DI 11 with smoothed ADX (was 11.5)
27b9581	0.769992	0.8323	-0.1556	keep	volume window 60 (was 50)
638846b	0.730555	0.8160	-0.1673	discard	volume window 70 (was 60)
7aec3fb	0.748327	0.8488	-0.1557	discard	volume window 55 (was 60)
646ccc2	0.780570	0.8323	-0.1556	keep	BB breakout DI 8.5 (was 9)
08f9413	0.764973	0.8177	-0.1556	discard	BB breakout DI 8 (was 8.5)
c7e08c2	0.764973	0.8177	-0.1556	discard	BB breakout DI 8.25 (was 8.5)
6321ecb	0.725616	0.9124	-0.1556	discard	secondary DI 5.5 (was 6)
4bfa48b	0.771545	0.8323	-0.1556	discard	vol regime 1.95x (was 2.0x)
b9955d0	0.686151	0.7692	-0.1784	discard	SMA45 trend (was SMA50)
1ff11ff	0.697337	0.7856	-0.1819	discard	BB period 22 (was 20)
3333ec7	0.758389	0.8152	-0.1631	discard	vol regime window 300 (was 252)
bed0139	0.746635	0.8023	-0.1556	discard	primary DI 11.25 (was 11.5)
a04ef4a	0.657195	0.8461	-0.1561	discard	remove volume filter from primary
04d0414	0.682333	0.8714	-0.1411	discard	ADX period 13 (was 14)
6ff7068	0.774427	0.8196	-0.1555	discard	BB std 2.1 (was 2.0)
b38f893	0.742773	0.8158	-0.1645	discard	volume threshold 0.95x (was 1.0x)
432ee73	0.768343	0.8178	-0.1687	discard	secondary ADX 39.5 (was 40)
f7a1bad	0.736112	0.9469	-0.1486	discard	primary DI 11.75 (was 11.5)
1537992	0.748408	0.8216	-0.1599	discard	vol regime 15-day (was 20)
b04dbf0	0.766765	0.8177	-0.1556	discard	DI EMA span 2.5 (was 3)
30299cb	0.781521	0.8323	-0.1556	keep	BB breakout DI 8.75 (was 8.5)
57bbf9c	0.769992	0.8323	-0.1556	discard	BB breakout DI 9.0 (was 8.75)
4926ce3	0.755293	0.8314	-0.1590	discard	volume window 65 (was 60)
2b2065c	0.760756	0.8024	-0.1561	discard	primary DI 11.6 (was 11.5)
3f571d5	0.766118	0.8141	-0.1632	discard	secondary ADX 39.75 (was 40)
d91267f	0.781277	0.8323	-0.1556	discard	vol regime 2.05x (was 2.0x)
daad85e	0.777136	0.8323	-0.1556	discard	primary ADX 19.5 (was 20)
3e831bf	0.756879	0.8270	-0.1556	discard	secondary DI 6.25 (was 6)
1cdcb09	0.773839	0.8202	-0.1556	discard	BB std 2.05 (was 2.0)
034304d	0.777977	0.8323	-0.1556	discard	volume window 62 (was 60)
f22578f	0.781521	0.8323	-0.1556	discard	primary DI 11.45 (was 11.5)
e7b0efb	0.753991	0.8360	-0.1578	discard	ADX EMA span 3.5 (was 3)
806fa8e	0.727615	0.7676	-0.1578	discard	BB period 19 (was 20)
d1edb78	0.749825	0.8107	-0.1676	discard	SMA 52 (was 50)
824fbe4	0.781521	0.8323	-0.1556	discard	BB breakout DI 8.6 (was 8.75)
3782e8f	0.769992	0.8323	-0.1556	discard	DI EMA span 3.2 (was 3)
b2f571c	0.781521	0.8323	-0.1556	discard	vol regime window 240 (was 252)
e78542d	0.764145	0.8323	-0.1556	discard	vol regime 1.98x (was 2.0x)
3db2419	0.782357	0.8356	-0.1538	keep	BB breakout DI 8.8 + volume window 58
cc982cb	0.757774	0.8551	-0.1524	discard	volume window 56 (was 58)
4a7d3f4	0.774895	0.8356	-0.1538	discard	BB breakout DI 8.9 (was 8.8)
87fa47d	0.782357	0.8356	-0.1538	discard	primary DI 11.55 (was 11.5)
842260d	0.768409	0.8191	-0.1614	discard	secondary ADX 39.8 (was 40)
36c6e13	0.773280	0.8356	-0.1538	discard	volume window 59 (was 58)
528b390	0.782357	0.8356	-0.1538	discard	primary DI 11.4 (was 11.5)
9b9256c	0.786364	0.8356	-0.1538	keep	BB breakout DI 8.7 (was 8.8)
2f4e404	0.786364	0.8356	-0.1538	discard	BB breakout DI 8.65 (was 8.7)
3aaf98c	0.758279	0.8551	-0.1524	discard	volume window 57 (was 58)
386376d	0.748466	0.8155	-0.1620	discard	primary ADX 20.5 (was 20)
e05faa1	0.732623	0.8955	-0.1538	discard	secondary DI 5.9 (was 6)
5fda29c	0.781178	0.8356	-0.1538	discard	SMA 49 (was 50)
fc648e3	0.785933	0.8356	-0.1538	discard	vol regime 2.02x (was 2.0x)
ef455c5	0.786364	0.8356	-0.1538	discard	BB breakout DI 8.68 + vol regime window 245
0c09de2	0.765408	0.8155	-0.1633	discard	ADX EMA span 2.9 (was 3)
f27debd	0.779136	0.8210	-0.1538	discard	BB breakout MACD histogram confirmation
09a1dfc	0.587703	0.7561	-0.1824	discard	BB dip-buy ROC(10) momentum filter
8cc9081	0.738760	0.7917	-0.1491	discard	BB breakout 1% above upper band
b2f06d5	0.785407	0.8447	-0.1538	discard	BB breakout requires BB expansion
4793d5d	0.669087	0.7208	-0.1113	discard	Secondary entry volume confirmation
b7abbf9	0.786364	0.8356	-0.1538	discard	BB breakout DI 8.72 (was 8.7)
59eabeb	0.786364	0.8356	-0.1538	discard	Primary DI 11.42 (was 11.5)
640c085	0.678513	0.9995	-0.1687	discard	Add Williams %R oversold entry
f5da4ac	0.786642	0.8356	-0.1538	keep	SMA51 trend filter (was 50)
6c9e927	0.786642	0.8356	-0.1538	discard	BB breakout DI 8.65 (was 8.7)
72d9530	0.757640	0.8270	-0.1560	discard	Secondary ADX 40.5 (was 40)
61f390a	0.786642	0.8356	-0.1538	discard	Primary DI 11.48 (was 11.5)
66a3511	0.777580	0.8356	-0.1538	discard	Volume window 59 (was 58)
d344c7e	0.786642	0.8356	-0.1538	discard	Primary DI 11.52 (was 11.5)
76c2ffd	0.760932	0.8316	-0.1538	discard	Secondary DI 6.1 (was 6)
545ac0b	0.779747	0.8356	-0.1538	discard	BB std 2.03 (was 2.0)
c164512	0.781562	0.8356	-0.1538	discard	Vol regime 2.01x (was 2.0x)
c4969f0	0.771724	0.8319	-0.1557	discard	Primary ADX 20.25 (was 20)
1cdeab0	0.775594	0.8356	-0.1538	discard	ADX EMA span 3.1 (was 3)
6ef0943	0.662427	1.0516	-0.1951	discard	Add Stochastic(14,3) oversold entry
0c9b7a8	0.766782	0.8209	-0.1538	discard	DI EMA span 2.8 (was 3)
d510329	0.775285	0.8356	-0.1538	discard	Secondary ADX 40.25 (was 40)
b80a5d1	0.786642	0.8356	-0.1538	discard	Primary DI 11.47 (was 11.5)
08bb627	0.786642	0.8356	-0.1538	discard	BB breakout DI 8.73 (was 8.7)
60d9ac6	0.786642	0.8356	-0.1538	discard	BB breakout DI 8.71 (was 8.7)
70cad8b	0.759379	0.8172	-0.1538	discard	Add CCI(20) oversold entry
af2855a	0.786642	0.8356	-0.1538	discard	Primary DI 11.49 (was 11.5)
ba80346	0.758557	0.8551	-0.1524	discard	BB breakout DI 8.74 + volume window 57
6b58eec	0.770999	0.8191	-0.1614	discard	Primary DI 11.51 + Secondary ADX 39.9
63d1e13	0.785967	0.8356	-0.1538	discard	Vol regime window 260 (was 252)
550ece2	0.770699	0.8165	-0.1579	discard	BB period 21 (was 20)
58ae68a	0.786642	0.8356	-0.1538	discard	Primary ADX 19.95 (was 20)
75cbd40	0.760932	0.8316	-0.1538	discard	Secondary DI 6.05 (was 6)
c62f164	0.661968	0.8067	-0.1758	discard	EMA51 trend filter (was SMA51)
b18f2da	0.764448	0.8155	-0.1633	discard	ADX EMA span 2.95 (was 3)
7d35835	0.779189	0.8356	-0.1538	discard	DI EMA span 3.05 (was 3)
038754a	0.762058	0.8551	-0.1524	discard	Volume window 56 (was 58)
83407fa	0.775594	0.8356	-0.1538	discard	Multi-param: DI 11.505, ADX 40.1, BB DI 8.705
2d4e6a3	0.711352	0.8277	-0.1636	discard	Add ATR filter to secondary entry
cef6805	0.786642	0.8356	-0.1538	discard	BB breakout DI 8.69 (was 8.7)
815b09d	0.777634	0.8356	-0.1538	discard	Vol regime 1.99x (was 2.0x)
627b278	0.786642	0.8356	-0.1538	discard	Primary DI 11.46 + BB DI 8.72
543abfc	0.777634	0.8356	-0.1538	discard	Vol regime window 248 (was 252)
d2debb4	0.758629	0.8345	-0.1538	discard	Add ROC(20) momentum filter to primary
0df8f98	0.777580	0.8356	-0.1538	discard	Volume window 59 (was 58)
0cd5317	0.779747	0.8356	-0.1538	discard	BB std 2.02 (was 2.0)
73c5289	0.786937	0.8319	-0.1557	keep	Primary DI 11.505 + ADX 20.1
3754372	0.786937	0.8319	-0.1557	discard	Primary DI 11.51 (was 11.505)
407410e	0.769291	0.8319	-0.1557	discard	Secondary ADX 40.05 (was 40)
26afe09	0.786937	0.8319	-0.1557	discard	BB breakout DI 8.705 (was 8.7)
04c98cc	0.785932	0.8319	-0.1557	discard	Primary ADX 20.05 (was 20.1)
e7be8e9	0.777878	0.8319	-0.1557	discard	Volume window 59 (was 58)
ddc0b01	0.786937	0.8319	-0.1557	discard	Primary DI 11.50 (was 11.505)
9d3f70d	0.786937	0.8319	-0.1557	discard	Primary ADX 20.15 (was 20.1)
8555a2c	0.786937	0.8319	-0.1557	discard	Primary DI 11.503 (was 11.505)
60e5ad7	0.742630	0.8102	-0.1677	discard	SMA 52 (was 51)
20d5530	0.786937	0.8319	-0.1557	discard	Primary DI 11.506 + ADX 20.12
3721243	0.786937	0.8319	-0.1557	discard	Secondary DI 6.02 (was 6)
2726bec	0.786937	0.8319	-0.1557	discard	Primary DI 11.507 (was 11.505)
d8da440	0.779891	0.8319	-0.1557	discard	Vol regime window 255 (was 252)
8666945	0.765453	0.8155	-0.1633	discard	Primary DI 11.504 + Secondary ADX 39.95
a0eab1e	0.786937	0.8319	-0.1557	discard	BB breakout DI 8.68 (was 8.7)
f52b1e5	0.579138	0.7524	-0.1843	discard	Exit on DI bearish crossover
91ae1aa	0.542424	0.6787	-0.1920	discard	Dual trend filter: EMA20 + SMA51
75ef300	0.774375	0.8319	-0.1557	discard	Add ROC(10) momentum to primary entry
34f0646	0.785982	0.8411	-0.1557	discard	BB breakout requires band expansion
2e7cf0f	0.785982	0.8411	-0.1557	discard	BB breakout DI 8.65 with expansion filter
4536e27	0.719398	0.7787	-0.1820	discard	Volume threshold 0.9x median
a99f0b1	0.522612	0.5605	-0.1673	discard	Secondary requires rising ADX
590c2d6	0.762959	0.8159	-0.1696	discard	Secondary ADX 39.5 (was 40)
faaecb6	0.786937	0.8319	-0.1557	discard	Primary DI 11.51 (was 11.505)
ac70f8a	0.521799	0.6065	-0.1881	discard	Add momentum spike entry (ROC5 > 2%)
90174ce	0.727081	0.7672	-0.1579	discard	BB period 19 (was 20)
dbe1ab6	0.765453	0.8155	-0.1633	discard	Multi-param: DI 11.51, BB DI 8.68, ADX 39.9
e3c5d21	0.546177	0.7709	-0.1367	discard	Primary entry avoids overextended (>5% above SMA51)
340c368	0.785932	0.8319	-0.1557	discard	Primary ADX 20.08 (was 20.1)
d8aeca6	0.786937	0.8319	-0.1557	discard	Primary DI 11.502 (was 11.505)
1aa31e2	0.580014	0.7524	-0.1843	discard	BB dip-buy requires DI > 4
267a873	0.786937	0.8319	-0.1557	discard	BB breakout DI 8.72 (was 8.7)
a8d43e3	0.758859	0.8514	-0.1543	discard	Volume window 57 (was 58)
94ff778	0.786659	0.8319	-0.1557	discard	SMA 50 (was 51)
5d4da07	0.786937	0.8319	-0.1557	discard	DI EMA span 2.95 (was 3)
03723a3	0.784459	0.8319	-0.1557	discard	BB std 2.01 (was 2.0)
67d5972	0.785222	0.8319	-0.1557	discard	Vol regime 2.03x (was 2.0x)
a0a5b70	0.786937	0.8319	-0.1557	discard	Secondary DI 5.98 (was 6)
556602e	0.664087	0.7516	-0.1599	discard	Add 10-day high breakout entry
b1e0c5b	0.786937	0.8319	-0.1557	discard	ADX EMA span 3.02 (was 3)
cccb41e	0.786937	0.8319	-0.1557	discard	Multi-param: Primary ADX 20.12 + DI 11.508
8fba6c2	0.777932	0.8319	-0.1557	discard	Vol regime window 250 (was 252)
857712d	0.786937	0.8319	-0.1557	discard	BB breakout DI 8.69 (was 8.7)
6e8382b	0.786937	0.8319	-0.1557	discard	Multi-param: DI 11.5045 + BB DI 8.71
5807b08	0.669607	0.7941	-0.1783	discard	BB dip-buy requires volume spike (>1.2x median)
200e3de	0.775889	0.8319	-0.1557	discard	Secondary ADX 40.15 (was 40)
5d73835	0.786937	0.8319	-0.1557	discard	Multi: Primary DI 11.5048 ADX 20.11 BB DI 8.705
fbcafc6	0.786937	0.8319	-0.1557	discard	Primary DI 11.509 (was 11.505)
0063644	0.786937	0.8319	-0.1557	discard	Primary DI 11.495 (was 11.505)
e914501	0.775206	0.8221	-0.1609	discard	Volume window 61 (was 58)
2f2b486	0.786937	0.8319	-0.1557	discard	DI smooth span 2.98 (was 3)
b296fe2	0.786937	0.8319	-0.1557	discard	Primary ADX 20.095 (was 20.1)
3794140	0.787261	0.8319	-0.1557	keep	Secondary DI 5.95 (was 6)
3718ab5	0.787261	0.8319	-0.1557	discard	Secondary DI 5.93 (was 5.95)
1758bdc	0.786937	0.8319	-0.1557	discard	Secondary DI 5.97 (was 5.95)
a562fb6	0.787261	0.8319	-0.1557	discard	Primary DI 11.506 + Secondary DI 5.95
ff3fe46	0.787261	0.8319	-0.1557	discard	BB DI 8.695 + Secondary DI 5.95
cccb6ef	0.730507	0.8141	-0.1452	discard	ATR position sizing (0.5x/1.0x)
35e6ae3	0.607716	0.6309	-0.2084	discard	Add RSI(2) mean reversion overlay
b91751c	0.787261	0.8319	-0.1557	discard	Add seasonality filter (avoid Monday)
8047fcd	0.787261	0.8319	-0.1557	discard	Add weekly SMA20 multi-timeframe regime filter
410cdda	0.057520	-0.0921	-0.1474	discard	Add skip-month momentum filter (12-1mo)
4062080	0.787261	0.8319	-0.1557	discard	Regime switching: trend-following vs mean-reversion
72b221c	0.579824	0.7524	-0.1843	discard	Remove BB dip-buy entry (simplify)
5141aac	0.787261	0.8319	-0.1557	discard	Secondary DI 5.94 (was 5.95)
35d739e	0.787261	0.8319	-0.1557	discard	Secondary DI 5.96 (was 5.95)
73b28c3	0.787261	0.8319	-0.1557	discard	Secondary DI 5.94 (was 5.96)
4d1f3bb	0.787261	0.8319	-0.1557	discard	BB breakout DI 8.66 (was 8.7)
082a47b	0.787261	0.8319	-0.1557	discard	Primary DI 11.52 (was 11.505)
ace7e1a	0.787261	0.8319	-0.1557	discard	Multi: Primary DI 11.51 + Secondary DI 5.96 + BB DI 8.69
8df266a	0.787261	0.8319	-0.1557	discard	Primary DI 11.54 (was 11.51)
6d16268	0.776213	0.8319	-0.1557	discard	Secondary ADX 40.2 (was 40)
234fe34	0.767745	0.8159	-0.1696	discard	Secondary ADX 39.7 (was 40.2)
f3e07d2	0.787261	0.8319	-0.1557	discard	Secondary ADX 40 + DI 5.92 (was 39.7 + 5.96)
ec7c4f2	0.787261	0.8319	-0.1557	discard	Primary DI 11.48 (was 11.54)
a0062fa	0.750733	0.8102	-0.1677	discard	SMA 52 + volume window 59 (was 51 + 58)
9435614	0.760183	0.8514	-0.1543	discard	Volume window 56 (was 59)
a6f4308	0.787261	0.8319	-0.1557	discard	Volume window 58 (restore baseline)
9a4c5dc	0.787261	0.8319	-0.1557	discard	Primary DI 11.502 (was 11.48)
9497934	0.784775	0.8319	-0.1557	discard	Secondary DI 5.91 (was 5.92)
4d5f3f4	0.786937	0.8319	-0.1557	discard	Secondary DI 5.99 (was 5.91)
b9306a7	0.786937	0.8319	-0.1557	discard	BB breakout DI 8.64 (was 8.69)
6fc3e5f	0.782929	0.8319	-0.1557	discard	BB breakout DI 8.76 (was 8.64)
96ec448	0.782929	0.8319	-0.1557	discard	Primary DI 11.505 + ADX 20.15 (was 11.502 + 20.1)
802482a	0.762216	0.8155	-0.1633	discard	Primary ADX 20.1 + Secondary ADX 39.85 + DI 5.95
6da21f0	0.772206	0.8319	-0.1557	discard	Secondary ADX 40.1 (was 39.85)
3ec0330	0.787261	0.8319	-0.1557	discard	Restore baseline params (ADX 40, BB DI 8.7)
b04a4b3	0.784953	0.8319	-0.1557	discard	Vol regime 2.04x (was 2.0x)
a995a24	0.775063	0.8319	-0.1557	discard	Vol regime 1.97x (was 2.04x)
da5bd89	0.787261	0.8319	-0.1557	discard	Vol regime 2.0x (restore)
ef350a9	0.762733	0.8128	-0.1599	discard	BB period 21 (was 20)
